{
  "x-transport-version": "1.0",
  "x-message-id": "11111111-1111-4111-8111-111111111111",
  "x-correlation-id": "22222222-2222-4222-8222-222222222222",
  "x-attempt": 2,
  "x-max-attempts": 3,
  "x-retry-reason": "TRANSIENT_PROVIDER_ERROR",
  "x-original-routing-key": "openstack.connection.validate"
}
